{
  "schemaVersion": 1,
  "manifestType": "world-builder-npc-definitions",
  "provider": {
    "identity": "spoiled-milk-core-final-client-npc-definitions",
    "definitionMode": "members-enabled-post-override",
    "finalClientNpcCount": 862,
    "finalClientNpcCatalogSha256": "2763a649f0973dd65502f64495415f16fd8b7011a2c8f64d326612d16d103154",
    "sources": [
      {
        "role": "final-client-definition-runtime",
        "identity": "EntityHandler.java",
        "sha256": "4284b88eb36847ce432797e16dd6fe3996402c476469192b681e4c1b424e95f6"
      },
      {
        "role": "final-client-definition-runtime",
        "identity": "NPCDef.java",
        "sha256": "fb8a191fca5beee5e697b52eb8fb2c8dd5b24115fb62e38a7dfbb506cb38f78c"
      },
      {
        "role": "declarative-npc-registry",
        "identity": "NpcDefs.json",
        "sha256": "6067bf2bda56e40f568c8386c5e21786fa6ef6e963fae8b249b1ce149be4bbef"
      },
      {
        "role": "declarative-npc-registry",
        "identity": "NpcDefsCustom.json",
        "sha256": "cff22b7a478b0b6c9a9ee56e0eecdc14bac65ef4197d03786f3e0ce139167438"
      },
      {
        "role": "extension-npc-definitions",
        "identity": "MonsterSlayerNpcDefs.json",
        "sha256": "5e7e6e276d46d37e9572679518740d431f034e209f8bb64411bd58d53883c213"
      },
      {
        "role": "authoritative-npc-placements",
        "identity": "MyWorldNpcLocs.json",
        "sha256": "7e89daa91521365ab0362894431eebd89edf4fcf07fc8c08fc71db78009cd93f"
      }
    ]
  },
  "assetProviders": {
    "customSpriteArchive": {
      "path": "assets/archives/Custom_Sprites.osar",
      "sha256": "f334d99403c6db0b2baa629ddfbd959e741aaf62265650eacdc4db5d9a9c7a92",
      "entryCount": 1002
    },
    "authenticSpriteArchive": {
      "path": "assets/archives/Authentic_Sprites.orsc",
      "sha256": "cf861efa7307556b5e5ba4c20b838f17753faba8b530f85dca38e8c2839d5e69",
      "numericEntryCount": 2259
    }
  },
  "selection": {
    "kind": "placed-extension-beyond-declarative-registry",
    "declarativeMaximumNpcId": 845,
    "placementCount": 14,
    "npcCount": 14,
    "placedNpcIds": [
      846,
      847,
      848,
      849,
      850,
      852,
      853,
      854,
      855,
      856,
      857,
      858,
      859,
      860
    ],
    "placementCountByNpcId": [
      {
        "npcId": 846,
        "count": 1
      },
      {
        "npcId": 847,
        "count": 1
      },
      {
        "npcId": 848,
        "count": 1
      },
      {
        "npcId": 849,
        "count": 1
      },
      {
        "npcId": 850,
        "count": 1
      },
      {
        "npcId": 852,
        "count": 1
      },
      {
        "npcId": 853,
        "count": 1
      },
      {
        "npcId": 854,
        "count": 1
      },
      {
        "npcId": 855,
        "count": 1
      },
      {
        "npcId": 856,
        "count": 1
      },
      {
        "npcId": 857,
        "count": 1
      },
      {
        "npcId": 858,
        "count": 1
      },
      {
        "npcId": 859,
        "count": 1
      },
      {
        "npcId": 860,
        "count": 1
      }
    ],
    "npcIdsSha256": "21c68c1e0ab427aa5765b16d6c7c5d566c8c59843c47962f3794b08322a561b1",
    "definitionsSha256": "d82055ac8cc599112dd5c15b4860ab24c753d9020c2b7f590f3b0e9995868f1f",
    "animationsSha256": "a8abc2524ae34898b4f0be5eb133ead202f7313dba0887cc4e1dfb54b774dcc0"
  },
  "npcDefinitions": [
    {
      "npcId": 846,
      "definitionId": 846,
      "name": "Hobart",
      "description": "A cheery Monster Slayer recruiter",
      "command1": "Task",
      "command2": null,
      "attack": 1,
      "strength": 1,
      "hits": 1,
      "defense": 1,
      "attackable": false,
      "spriteAnimationIds": [
        6,
        27,
        36,
        97,
        47,
        -1,
        -1,
        -1,
        -1,
        -1,
        -1,
        -1
      ],
      "hairColour": 6307872,
      "topColour": 8421504,
      "bottomColour": 8421504,
      "skinColour": 15523536,
      "cameraWidth": 145,
      "cameraHeight": 220,
      "walkModel": 6,
      "combatModel": 6,
      "combatSprite": 5
    },
    {
      "npcId": 847,
      "definitionId": 847,
      "name": "Mara",
      "description": "A practical Monster Slayer contact",
      "command1": "Task",
      "command2": null,
      "attack": 1,
      "strength": 1,
      "hits": 1,
      "defense": 1,
      "attackable": false,
      "spriteAnimationIds": [
        3,
        55,
        37,
        98,
        48,
        -1,
        -1,
        -1,
        -1,
        -1,
        -1,
        -1
      ],
      "hairColour": 16753488,
      "topColour": 15654365,
      "bottomColour": 15654365,
      "skinColour": 15523536,
      "cameraWidth": 145,
      "cameraHeight": 220,
      "walkModel": 6,
      "combatModel": 6,
      "combatSprite": 5
    },
    {
      "npcId": 848,
      "definitionId": 848,
      "name": "Bran",
      "description": "A hardened Blue Moon Monster Slayer contact",
      "command1": "Task",
      "command2": null,
      "attack": 1,
      "strength": 1,
      "hits": 1,
      "defense": 1,
      "attackable": false,
      "spriteAnimationIds": [
        7,
        29,
        38,
        99,
        49,
        -1,
        -1,
        -1,
        -1,
        -1,
        -1,
        -1
      ],
      "hairColour": 16753488,
      "topColour": 15658734,
      "bottomColour": 15658734,
      "skinColour": 15523536,
      "cameraWidth": 145,
      "cameraHeight": 220,
      "walkModel": 6,
      "combatModel": 6,
      "combatSprite": 5
    },
    {
      "npcId": 849,
      "definitionId": 849,
      "name": "Doran",
      "description": "A Champions Guild Monster Slayer contact",
      "command1": "Task",
      "command2": null,
      "attack": 1,
      "strength": 1,
      "hits": 1,
      "defense": 1,
      "attackable": false,
      "spriteAnimationIds": [
        15,
        30,
        39,
        100,
        50,
        -1,
        -1,
        -1,
        -1,
        -1,
        -1,
        -1
      ],
      "hairColour": 8421504,
      "topColour": 10072780,
      "bottomColour": 10072780,
      "skinColour": 15523536,
      "cameraWidth": 145,
      "cameraHeight": 220,
      "walkModel": 6,
      "combatModel": 6,
      "combatSprite": 5
    },
    {
      "npcId": 850,
      "definitionId": 850,
      "name": "Sella",
      "description": "An inspiring Heroes Guild Monster Slayer contact",
      "command1": "Task",
      "command2": null,
      "attack": 1,
      "strength": 1,
      "hits": 1,
      "defense": 1,
      "attackable": false,
      "spriteAnimationIds": [
        16,
        58,
        40,
        101,
        51,
        -1,
        -1,
        -1,
        -1,
        -1,
        -1,
        -1
      ],
      "hairColour": 6307872,
      "topColour": 11717785,
      "bottomColour": 11717785,
      "skinColour": 15523536,
      "cameraWidth": 145,
      "cameraHeight": 220,
      "walkModel": 6,
      "combatModel": 6,
      "combatSprite": 5
    },
    {
      "npcId": 852,
      "definitionId": 852,
      "name": "Slayer shop associate",
      "description": "A Fledgling Slayer supplier",
      "command1": "Trade",
      "command2": null,
      "attack": 1,
      "strength": 1,
      "hits": 1,
      "defense": 1,
      "attackable": false,
      "spriteAnimationIds": [
        3,
        54,
        2,
        -1,
        108,
        -1,
        -1,
        -1,
        -1,
        -1,
        -1,
        -1
      ],
      "hairColour": 16753488,
      "topColour": 16737817,
      "bottomColour": 8421504,
      "skinColour": 15523536,
      "cameraWidth": 145,
      "cameraHeight": 220,
      "walkModel": 6,
      "combatModel": 6,
      "combatSprite": 5
    },
    {
      "npcId": 853,
      "definitionId": 853,
      "name": "Slayer shop associate",
      "description": "An Adept Slayer supplier",
      "command1": "Trade",
      "command2": null,
      "attack": 1,
      "strength": 1,
      "hits": 1,
      "defense": 1,
      "attackable": false,
      "spriteAnimationIds": [
        6,
        28,
        2,
        -1,
        109,
        -1,
        -1,
        -1,
        -1,
        -1,
        -1,
        -1
      ],
      "hairColour": 6307872,
      "topColour": 15654365,
      "bottomColour": 8421504,
      "skinColour": 15523536,
      "cameraWidth": 145,
      "cameraHeight": 220,
      "walkModel": 6,
      "combatModel": 6,
      "combatSprite": 5
    },
    {
      "npcId": 854,
      "definitionId": 854,
      "name": "Slayer shop associate",
      "description": "A Blue Moon Veteran Slayer supplier",
      "command1": "Trade",
      "command2": null,
      "attack": 1,
      "strength": 1,
      "hits": 1,
      "defense": 1,
      "attackable": false,
      "spriteAnimationIds": [
        3,
        56,
        2,
        -1,
        110,
        -1,
        -1,
        -1,
        -1,
        -1,
        -1,
        -1
      ],
      "hairColour": 6307872,
      "topColour": 15658734,
      "bottomColour": 8421504,
      "skinColour": 15523536,
      "cameraWidth": 145,
      "cameraHeight": 220,
      "walkModel": 6,
      "combatModel": 6,
      "combatSprite": 5
    },
    {
      "npcId": 855,
      "definitionId": 855,
      "name": "Slayer shop associate",
      "description": "An Elite Slayer quartermaster",
      "command1": "Trade",
      "command2": null,
      "attack": 1,
      "strength": 1,
      "hits": 1,
      "defense": 1,
      "attackable": false,
      "spriteAnimationIds": [
        3,
        57,
        2,
        -1,
        111,
        -1,
        -1,
        -1,
        -1,
        -1,
        -1,
        -1
      ],
      "hairColour": 16753488,
      "topColour": 10072780,
      "bottomColour": 8421504,
      "skinColour": 15523536,
      "cameraWidth": 145,
      "cameraHeight": 220,
      "walkModel": 6,
      "combatModel": 6,
      "combatSprite": 5
    },